{
  "schemaVersion": 1,
  "studioId": "estudio-marco-zero-vila-velha-8fd10f",
  "sourceId": "8fd10f3da69aefc4b4c8e9746fceea7a561fb4baef88e79635cb9239e2da0613",
  "name": "Estúdio Marco Zero",
  "type": "Recording studio",
  "slug": "estudio-marco-zero",
  "location": {
    "city": "Vila Velha",
    "state": "Espírito Santo",
    "address": "2o. andar 29100-012, Av. Jerônimo Monteiro, 439 - Centro de Vila Velha, Vila Velha - ES, 29100-401, Brazil",
    "latitude": -20.335268799999998,
    "longitude": -40.297774
  },
  "contacts": {
    "phone": "+55 27 99700-0417",
    "website": "https://www.instagram.com/estudiomarcozero/",
    "instagram": "https://www.instagram.com/estudiomarcozero/"
  },
  "source": {
    "importedAt": "2026-08-13T04:49:30Z",
    "sourceFile": "estudios_musica.json",
    "sourceHash": "40d819f689b89d53af6a33a970b4e20276a6264053917227904c49c132f6b585",
    "originalRecord": {
      "title": "Estúdio Marco Zero",
      "type": "Recording studio",
      "cidade": "Vila Velha",
      "estado": "Espírito Santo",
      "ratingCount": 73,
      "rating": 4.8,
      "address": "2o. andar 29100-012, Av. Jerônimo Monteiro, 439 - Centro de Vila Velha, Vila Velha - ES, 29100-401, Brazil",
      "phoneNumber": "+55 27 99700-0417",
      "website": "https://www.instagram.com/estudiomarcozero/",
      "latitude": -20.335268799999998,
      "longitude": -40.297774,
      "score_comercial": 97.89,
      "score_componentes": {
        "website": {
          "pontos": 60,
          "maximo": 60,
          "categoria": "rede_social_ou_intermediario",
          "valor": "https://www.instagram.com/estudiomarcozero/"
        },
        "telefone": {
          "pontos": 15,
          "maximo": 15,
          "presente": true
        },
        "endereco": {
          "pontos": 5,
          "maximo": 5,
          "presente": true
        },
        "nota": {
          "pontos": 4.8,
          "maximo": 5,
          "valor": 4.8
        },
        "quantidade_avaliacoes": {
          "pontos": 13.09,
          "maximo": 15,
          "valor": 73,
          "referencia_percentil_95": 137.45
        }
      },
      "score_justificativa": [
        "Possui rede social ou página intermediária, mas não site próprio.",
        "Possui telefone para contato.",
        "Possui endereço informado.",
        "Nota bruta considerada: 4.8 de 5.",
        "Quantidade de avaliações considerada: 73; pontuação calculada em escala logarítmica."
      ]
    }
  },
  "commercialScore": 97.89,
  "pipelineStatus": "approved",
  "updatedAt": "2026-08-13T04:49:30Z"
}
