{
  "schemaVersion": 1,
  "studioId": "studio-art-som-santos-def2a5",
  "sourceId": "def2a5d9e82fa36deca05a850851224667bd3fb76568ec8c24813bcf1a1bd2e4",
  "name": "Studio Art Som",
  "type": "Recording studio",
  "slug": "studio-art-som",
  "location": {
    "city": "Santos",
    "state": "São Paulo",
    "address": "R. Fumio Miyazi, 531 - Boqueirão, Praia Grande - SP, 11701-160, Brazil",
    "latitude": -24.0065486,
    "longitude": -46.418734
  },
  "contacts": {
    "phone": "+55 13 99197-9227",
    "website": "https://pt-br.facebook.com/studioartsom",
    "facebook": "https://pt-br.facebook.com/studioartsom"
  },
  "source": {
    "importedAt": "2026-08-13T04:49:30Z",
    "sourceFile": "estudios_musica.json",
    "sourceHash": "d17cfd29acfb4845e9e7bb51ea557a37a2c7e75a92652860295f7bec19ee546f",
    "originalRecord": {
      "title": "Studio Art Som",
      "type": "Recording studio",
      "cidade": "Santos",
      "estado": "São Paulo",
      "ratingCount": 79,
      "rating": 4.7,
      "address": "R. Fumio Miyazi, 531 - Boqueirão, Praia Grande - SP, 11701-160, Brazil",
      "phoneNumber": "+55 13 99197-9227",
      "website": "https://pt-br.facebook.com/studioartsom",
      "latitude": -24.0065486,
      "longitude": -46.418734,
      "score_comercial": 98.03,
      "score_componentes": {
        "website": {
          "pontos": 60,
          "maximo": 60,
          "categoria": "rede_social_ou_intermediario",
          "valor": "https://pt-br.facebook.com/studioartsom"
        },
        "telefone": {
          "pontos": 15,
          "maximo": 15,
          "presente": true
        },
        "endereco": {
          "pontos": 5,
          "maximo": 5,
          "presente": true
        },
        "nota": {
          "pontos": 4.7,
          "maximo": 5,
          "valor": 4.7
        },
        "quantidade_avaliacoes": {
          "pontos": 13.33,
          "maximo": 15,
          "valor": 79,
          "referencia_percentil_95": 137.45
        }
      },
      "score_justificativa": [
        "Possui rede social ou página intermediária, mas não site próprio.",
        "Possui telefone para contato.",
        "Possui endereço informado.",
        "Nota bruta considerada: 4.7 de 5.",
        "Quantidade de avaliações considerada: 79; pontuação calculada em escala logarítmica."
      ]
    }
  },
  "commercialScore": 98.03,
  "pipelineStatus": "approved",
  "updatedAt": "2026-08-13T04:49:30Z"
}
