{
  "schemaVersion": 1,
  "studioId": "estudio-akira-criciuma-5d78fa",
  "sourceId": "5d78fa9aa72a93aeb42709632506e306a85043ea7a629ec4e735ee7489e16b2c",
  "name": "Estúdio Akira",
  "type": "Recording studio",
  "slug": "estudio-akira",
  "location": {
    "city": "Criciúma",
    "state": "Santa Catarina",
    "address": "R. Niterói - Brasília, Criciúma - SC, 88813-175, Brazil",
    "latitude": -28.6772739,
    "longitude": -49.3361683
  },
  "contacts": {
    "phone": "+55 48 99654-8139",
    "website": "https://instagram.com/estudioakiraa?igshid=YmMyMTA2M2Y=",
    "instagram": "https://instagram.com/estudioakiraa?igshid=YmMyMTA2M2Y="
  },
  "source": {
    "importedAt": "2026-08-13T04:49:30Z",
    "sourceFile": "estudios_musica.json",
    "sourceHash": "83c26edbfc998bb03fdb5ebef601ab17a7f14ded6c78a2dc874e66d217acae09",
    "originalRecord": {
      "title": "Estúdio Akira",
      "type": "Recording studio",
      "cidade": "Criciúma",
      "estado": "Santa Catarina",
      "ratingCount": 69,
      "rating": 5,
      "address": "R. Niterói - Brasília, Criciúma - SC, 88813-175, Brazil",
      "phoneNumber": "+55 48 99654-8139",
      "website": "https://instagram.com/estudioakiraa?igshid=YmMyMTA2M2Y=",
      "latitude": -28.6772739,
      "longitude": -49.3361683,
      "score_comercial": 97.93,
      "score_componentes": {
        "website": {
          "pontos": 60,
          "maximo": 60,
          "categoria": "rede_social_ou_intermediario",
          "valor": "https://instagram.com/estudioakiraa?igshid=YmMyMTA2M2Y="
        },
        "telefone": {
          "pontos": 15,
          "maximo": 15,
          "presente": true
        },
        "endereco": {
          "pontos": 5,
          "maximo": 5,
          "presente": true
        },
        "nota": {
          "pontos": 5,
          "maximo": 5,
          "valor": 5
        },
        "quantidade_avaliacoes": {
          "pontos": 12.93,
          "maximo": 15,
          "valor": 69,
          "referencia_percentil_95": 137.45
        }
      },
      "score_justificativa": [
        "Possui rede social ou página intermediária, mas não site próprio.",
        "Possui telefone para contato.",
        "Possui endereço informado.",
        "Nota bruta considerada: 5.0 de 5.",
        "Quantidade de avaliações considerada: 69; pontuação calculada em escala logarítmica."
      ]
    }
  },
  "commercialScore": 97.93,
  "pipelineStatus": "approved",
  "updatedAt": "2026-08-13T04:49:30Z"
}
