{
  "schemaVersion": 1,
  "studioId": "d-lima-studio-vitoria-de-s-4fdc57",
  "sourceId": "4fdc57f15a199281cbb79f8d9265676dd78d0df15e23cd185dec3f4d189f58c0",
  "name": "D'lima Stúdio",
  "type": "Recording studio",
  "slug": "d-lima-studio",
  "location": {
    "city": "Vitória de Santo Antão",
    "state": "Pernambuco",
    "address": "R. Batalha das Tabocas, 49 - Lídia Queiroz, Vitória de Santo Antão - PE, 55614-080, Brazil",
    "latitude": -8.123209899999999,
    "longitude": -35.2834593
  },
  "contacts": {
    "phone": "+55 986047826",
    "website": "https://www.facebook.com/pages/DL-St%C3%BAdio/211208629064877?ref=ts&fref=ts",
    "facebook": "https://www.facebook.com/pages/DL-St%C3%BAdio/211208629064877?ref=ts&fref=ts"
  },
  "source": {
    "importedAt": "2026-08-13T04:49:30Z",
    "sourceFile": "estudios_musica.json",
    "sourceHash": "f0326f8c0c637997856e48bb2f516f2d525249e5a9cac87af7ac55bb69fa030d",
    "originalRecord": {
      "title": "D'lima Stúdio",
      "type": "Recording studio",
      "cidade": "Vitória de Santo Antão",
      "estado": "Pernambuco",
      "ratingCount": 50,
      "rating": 4,
      "address": "R. Batalha das Tabocas, 49 - Lídia Queiroz, Vitória de Santo Antão - PE, 55614-080, Brazil",
      "phoneNumber": "+55 986047826",
      "website": "https://www.facebook.com/pages/DL-St%C3%BAdio/211208629064877?ref=ts&fref=ts",
      "latitude": -8.123209899999999,
      "longitude": -35.2834593,
      "score_comercial": 95.96,
      "score_componentes": {
        "website": {
          "pontos": 60,
          "maximo": 60,
          "categoria": "rede_social_ou_intermediario",
          "valor": "https://www.facebook.com/pages/DL-St%C3%BAdio/211208629064877?ref=ts&fref=ts"
        },
        "telefone": {
          "pontos": 15,
          "maximo": 15,
          "presente": true
        },
        "endereco": {
          "pontos": 5,
          "maximo": 5,
          "presente": true
        },
        "nota": {
          "pontos": 4,
          "maximo": 5,
          "valor": 4
        },
        "quantidade_avaliacoes": {
          "pontos": 11.96,
          "maximo": 15,
          "valor": 50,
          "referencia_percentil_95": 137.45
        }
      },
      "score_justificativa": [
        "Possui rede social ou página intermediária, mas não site próprio.",
        "Possui telefone para contato.",
        "Possui endereço informado.",
        "Nota bruta considerada: 4.0 de 5.",
        "Quantidade de avaliações considerada: 50; pontuação calculada em escala logarítmica."
      ]
    }
  },
  "commercialScore": 95.96,
  "pipelineStatus": "approved",
  "updatedAt": "2026-08-13T04:49:30Z"
}
