{
  "schemaVersion": 1,
  "studioId": "estudio-house-mix-mogi-das-cru-b34a94",
  "sourceId": "b34a94778055d5138fc3b3d1bf48e4682393bd5dbdea73c1378b1eb81935063b",
  "name": "Estúdio House Mix",
  "type": "Recording studio",
  "slug": "estudio-house-mix",
  "location": {
    "city": "Mogi das Cruzes",
    "state": "São Paulo",
    "address": "R. Ipiranga, 1169 - Jardim Santista, Mogi das Cruzes - SP, 08730-000, Brazil",
    "latitude": -23.529278599999998,
    "longitude": -46.2012779
  },
  "contacts": {
    "phone": "+55 11 99609-7638",
    "website": "http://instagram.com/estudiohousemix",
    "instagram": "http://instagram.com/estudiohousemix"
  },
  "source": {
    "importedAt": "2026-08-13T04:49:30Z",
    "sourceFile": "estudios_musica.json",
    "sourceHash": "06a679f9d7525acdddee69792aa43d66d75aae7abe8cdd6525c225f23e7d690a",
    "originalRecord": {
      "title": "Estúdio House Mix",
      "type": "Recording studio",
      "cidade": "Mogi das Cruzes",
      "estado": "São Paulo",
      "ratingCount": 74,
      "rating": 5,
      "address": "R. Ipiranga, 1169 - Jardim Santista, Mogi das Cruzes - SP, 08730-000, Brazil",
      "phoneNumber": "+55 11 99609-7638",
      "website": "http://instagram.com/estudiohousemix",
      "latitude": -23.529278599999998,
      "longitude": -46.2012779,
      "score_comercial": 98.14,
      "score_componentes": {
        "website": {
          "pontos": 60,
          "maximo": 60,
          "categoria": "rede_social_ou_intermediario",
          "valor": "http://instagram.com/estudiohousemix"
        },
        "telefone": {
          "pontos": 15,
          "maximo": 15,
          "presente": true
        },
        "endereco": {
          "pontos": 5,
          "maximo": 5,
          "presente": true
        },
        "nota": {
          "pontos": 5,
          "maximo": 5,
          "valor": 5
        },
        "quantidade_avaliacoes": {
          "pontos": 13.14,
          "maximo": 15,
          "valor": 74,
          "referencia_percentil_95": 137.45
        }
      },
      "score_justificativa": [
        "Possui rede social ou página intermediária, mas não site próprio.",
        "Possui telefone para contato.",
        "Possui endereço informado.",
        "Nota bruta considerada: 5.0 de 5.",
        "Quantidade de avaliações considerada: 74; pontuação calculada em escala logarítmica."
      ]
    }
  },
  "commercialScore": 98.14,
  "pipelineStatus": "approved",
  "updatedAt": "2026-08-13T04:49:30Z"
}
