{
  "schemaVersion": 1,
  "studioId": "estudio-r-contagem-49a598",
  "sourceId": "49a598e408fbab0fb9664a690601db27319b2e525c0e0bf8b8be1d61e5f797d6",
  "name": "Estúdio R",
  "type": "Rehearsal studio",
  "slug": "estudio-r",
  "location": {
    "city": "Contagem",
    "state": "Minas Gerais",
    "address": "Av. Imbiruçu, 240 - Capelinha, Betim - MG, 32678-390, Brazil",
    "latitude": -19.941302699999998,
    "longitude": -44.1034764
  },
  "contacts": {
    "phone": "+55 31 98988-3287",
    "website": "https://www.instagram.com/estudior_?igsh=MWZtd2oxNGI5NWUzNg==",
    "instagram": "https://www.instagram.com/estudior_?igsh=MWZtd2oxNGI5NWUzNg=="
  },
  "source": {
    "importedAt": "2026-08-13T04:49:30Z",
    "sourceFile": "estudios_musica.json",
    "sourceHash": "9a467bf700b327b10127bc875a652631182d605d5d12fcf89910f9bcd6554133",
    "originalRecord": {
      "title": "Estúdio R",
      "type": "Rehearsal studio",
      "cidade": "Contagem",
      "estado": "Minas Gerais",
      "ratingCount": 63,
      "rating": 4.9,
      "address": "Av. Imbiruçu, 240 - Capelinha, Betim - MG, 32678-390, Brazil",
      "phoneNumber": "+55 31 98988-3287",
      "website": "https://www.instagram.com/estudior_?igsh=MWZtd2oxNGI5NWUzNg==",
      "latitude": -19.941302699999998,
      "longitude": -44.1034764,
      "score_comercial": 97.55,
      "score_componentes": {
        "website": {
          "pontos": 60,
          "maximo": 60,
          "categoria": "rede_social_ou_intermediario",
          "valor": "https://www.instagram.com/estudior_?igsh=MWZtd2oxNGI5NWUzNg=="
        },
        "telefone": {
          "pontos": 15,
          "maximo": 15,
          "presente": true
        },
        "endereco": {
          "pontos": 5,
          "maximo": 5,
          "presente": true
        },
        "nota": {
          "pontos": 4.9,
          "maximo": 5,
          "valor": 4.9
        },
        "quantidade_avaliacoes": {
          "pontos": 12.65,
          "maximo": 15,
          "valor": 63,
          "referencia_percentil_95": 137.45
        }
      },
      "score_justificativa": [
        "Possui rede social ou página intermediária, mas não site próprio.",
        "Possui telefone para contato.",
        "Possui endereço informado.",
        "Nota bruta considerada: 4.9 de 5.",
        "Quantidade de avaliações considerada: 63; pontuação calculada em escala logarítmica."
      ]
    }
  },
  "commercialScore": 97.55,
  "pipelineStatus": "approved",
  "updatedAt": "2026-08-13T04:49:30Z"
}
