{
  "schemaVersion": 1,
  "studioId": "synth-studio-sao-jose-dos-a187a5",
  "sourceId": "a187a505ce2c85d670407f9b0f594a4e8fff216b0a1e41ab0549955c23b42c8b",
  "name": "Synth Studio",
  "type": "Recording studio",
  "slug": "synth-studio",
  "location": {
    "city": "São José dos Campos",
    "state": "São Paulo",
    "address": "R. Ipiranga, 74 - Vila Ema, São José dos Campos - SP, 12243-400, Brazil",
    "latitude": -23.2078304,
    "longitude": -45.8958181
  },
  "contacts": {
    "phone": "+55 12 99665-0000",
    "website": "https://www.instagram.com/synthstudiobr/",
    "instagram": "https://www.instagram.com/synthstudiobr/"
  },
  "source": {
    "importedAt": "2026-08-13T04:49:30Z",
    "sourceFile": "estudios_musica.json",
    "sourceHash": "727f6c0e3a19c8f993e8b64f10296eec22493f5813b016fbed930c763f6eae0b",
    "originalRecord": {
      "title": "Synth Studio",
      "type": "Recording studio",
      "cidade": "São José dos Campos",
      "estado": "São Paulo",
      "ratingCount": 46,
      "rating": 5,
      "address": "R. Ipiranga, 74 - Vila Ema, São José dos Campos - SP, 12243-400, Brazil",
      "phoneNumber": "+55 12 99665-0000",
      "website": "https://www.instagram.com/synthstudiobr/",
      "latitude": -23.2078304,
      "longitude": -45.8958181,
      "score_comercial": 96.71,
      "score_componentes": {
        "website": {
          "pontos": 60,
          "maximo": 60,
          "categoria": "rede_social_ou_intermediario",
          "valor": "https://www.instagram.com/synthstudiobr/"
        },
        "telefone": {
          "pontos": 15,
          "maximo": 15,
          "presente": true
        },
        "endereco": {
          "pontos": 5,
          "maximo": 5,
          "presente": true
        },
        "nota": {
          "pontos": 5,
          "maximo": 5,
          "valor": 5
        },
        "quantidade_avaliacoes": {
          "pontos": 11.71,
          "maximo": 15,
          "valor": 46,
          "referencia_percentil_95": 137.45
        }
      },
      "score_justificativa": [
        "Possui rede social ou página intermediária, mas não site próprio.",
        "Possui telefone para contato.",
        "Possui endereço informado.",
        "Nota bruta considerada: 5.0 de 5.",
        "Quantidade de avaliações considerada: 46; pontuação calculada em escala logarítmica."
      ]
    }
  },
  "commercialScore": 96.71,
  "pipelineStatus": "approved",
  "updatedAt": "2026-08-13T04:49:30Z"
}
