{
  "schemaVersion": 1,
  "studioId": "estudio-bunker-cultural-araucaria-b5ed5b",
  "sourceId": "b5ed5b164149b959b7d53d16cc73b7c02276b90478859606c22f83bfee8d243b",
  "name": "Estúdio Bunker Cultural",
  "type": "Recording studio",
  "slug": "estudio-bunker-cultural",
  "location": {
    "city": "Araucária",
    "state": "Paraná",
    "address": "esq. com a - R. Cisne, R. Chopim, 780 - Capela Velha, Araucária - PR, 83705-680, Brazil",
    "latitude": -25.555549799999998,
    "longitude": -49.404216999999996
  },
  "contacts": {
    "phone": "+55 41 99674-3301",
    "website": "https://www.instagram.com/estudiobunkercultural/",
    "instagram": "https://www.instagram.com/estudiobunkercultural/"
  },
  "source": {
    "importedAt": "2026-08-13T04:49:30Z",
    "sourceFile": "estudios_musica.json",
    "sourceHash": "d7d6ffe899360f93b618ce0f4ef1645f5b632c159b24beb141f67792d5edc7ed",
    "originalRecord": {
      "title": "Estúdio Bunker Cultural",
      "type": "Recording studio",
      "cidade": "Araucária",
      "estado": "Paraná",
      "ratingCount": 42,
      "rating": 5,
      "address": "esq. com a - R. Cisne, R. Chopim, 780 - Capela Velha, Araucária - PR, 83705-680, Brazil",
      "phoneNumber": "+55 41 99674-3301",
      "website": "https://www.instagram.com/estudiobunkercultural/",
      "latitude": -25.555549799999998,
      "longitude": -49.404216999999996,
      "score_comercial": 96.44,
      "score_componentes": {
        "website": {
          "pontos": 60,
          "maximo": 60,
          "categoria": "rede_social_ou_intermediario",
          "valor": "https://www.instagram.com/estudiobunkercultural/"
        },
        "telefone": {
          "pontos": 15,
          "maximo": 15,
          "presente": true
        },
        "endereco": {
          "pontos": 5,
          "maximo": 5,
          "presente": true
        },
        "nota": {
          "pontos": 5,
          "maximo": 5,
          "valor": 5
        },
        "quantidade_avaliacoes": {
          "pontos": 11.44,
          "maximo": 15,
          "valor": 42,
          "referencia_percentil_95": 137.45
        }
      },
      "score_justificativa": [
        "Possui rede social ou página intermediária, mas não site próprio.",
        "Possui telefone para contato.",
        "Possui endereço informado.",
        "Nota bruta considerada: 5.0 de 5.",
        "Quantidade de avaliações considerada: 42; pontuação calculada em escala logarítmica."
      ]
    }
  },
  "commercialScore": 96.44,
  "pipelineStatus": "approved",
  "updatedAt": "2026-08-13T04:49:30Z"
}
