{
  "schemaVersion": 1,
  "studioId": "estudiocurtirsom-maracanau-846e90",
  "sourceId": "846e90c7ca04ede739507d9250ac25dcb4010e6232da85d741ae3dc7b8398c90",
  "name": "EstudioCurtirsom",
  "type": "Rehearsal studio",
  "slug": "estudiocurtirsom",
  "location": {
    "city": "Maracanaú",
    "state": "Ceará",
    "address": "R. Máximo Linhares, 320 - Cidade dos Funcionários, Fortaleza - CE, 60822-482, Brazil",
    "latitude": -3.798841,
    "longitude": -38.49283
  },
  "contacts": {
    "phone": "+55 85 98690-0431",
    "website": "https://www.instagram.com/estudiocurtirsom?igsh=MTEwZzVmcWN0cnlyNQ==",
    "instagram": "https://www.instagram.com/estudiocurtirsom?igsh=MTEwZzVmcWN0cnlyNQ=="
  },
  "source": {
    "importedAt": "2026-08-13T04:49:30Z",
    "sourceFile": "estudios_musica.json",
    "sourceHash": "f6ec3e9651227b7dbc5152a26ae2d064d8c44ea8a6b381e58a8c198cbfd9fc27",
    "originalRecord": {
      "title": "EstudioCurtirsom",
      "type": "Rehearsal studio",
      "cidade": "Maracanaú",
      "estado": "Ceará",
      "ratingCount": 93,
      "rating": 4.8,
      "address": "R. Máximo Linhares, 320 - Cidade dos Funcionários, Fortaleza - CE, 60822-482, Brazil",
      "phoneNumber": "+55 85 98690-0431",
      "website": "https://www.instagram.com/estudiocurtirsom?igsh=MTEwZzVmcWN0cnlyNQ==",
      "latitude": -3.798841,
      "longitude": -38.49283,
      "score_comercial": 98.62,
      "score_componentes": {
        "website": {
          "pontos": 60,
          "maximo": 60,
          "categoria": "rede_social_ou_intermediario",
          "valor": "https://www.instagram.com/estudiocurtirsom?igsh=MTEwZzVmcWN0cnlyNQ=="
        },
        "telefone": {
          "pontos": 15,
          "maximo": 15,
          "presente": true
        },
        "endereco": {
          "pontos": 5,
          "maximo": 5,
          "presente": true
        },
        "nota": {
          "pontos": 4.8,
          "maximo": 5,
          "valor": 4.8
        },
        "quantidade_avaliacoes": {
          "pontos": 13.82,
          "maximo": 15,
          "valor": 93,
          "referencia_percentil_95": 137.45
        }
      },
      "score_justificativa": [
        "Possui rede social ou página intermediária, mas não site próprio.",
        "Possui telefone para contato.",
        "Possui endereço informado.",
        "Nota bruta considerada: 4.8 de 5.",
        "Quantidade de avaliações considerada: 93; pontuação calculada em escala logarítmica."
      ]
    }
  },
  "commercialScore": 98.62,
  "pipelineStatus": "approved",
  "updatedAt": "2026-08-13T04:49:30Z"
}
