{
  "schemaVersion": 1,
  "studioId": "criasom-estudio-bauru-30e66d",
  "sourceId": "30e66dfd61daf8041d685580b2829c1b7517614b51bfb528acd2e7d9eb44779e",
  "name": "Criasom Estúdio",
  "type": "Recording studio",
  "slug": "criasom-estudio",
  "location": {
    "city": "Bauru",
    "state": "São Paulo",
    "address": "R. Célio Daibem, 11-12 - Jardim Estoril, Bauru - SP, 17015-080, Brazil",
    "latitude": -22.3375588,
    "longitude": -49.0794383
  },
  "contacts": {
    "phone": "+55 14 99132-4286",
    "website": "http://facebook.com/criasomestudio",
    "facebook": "http://facebook.com/criasomestudio"
  },
  "source": {
    "importedAt": "2026-08-13T04:49:30Z",
    "sourceFile": "estudios_musica.json",
    "sourceHash": "7ac7582985e6c46c4f84aa927a4162d78d14464f2c2b6ca5ad6dda775801e44d",
    "originalRecord": {
      "title": "Criasom Estúdio",
      "type": "Recording studio",
      "cidade": "Bauru",
      "estado": "São Paulo",
      "ratingCount": 56,
      "rating": 4.8,
      "address": "R. Célio Daibem, 11-12 - Jardim Estoril, Bauru - SP, 17015-080, Brazil",
      "phoneNumber": "+55 14 99132-4286",
      "website": "http://facebook.com/criasomestudio",
      "latitude": -22.3375588,
      "longitude": -49.0794383,
      "score_comercial": 97.1,
      "score_componentes": {
        "website": {
          "pontos": 60,
          "maximo": 60,
          "categoria": "rede_social_ou_intermediario",
          "valor": "http://facebook.com/criasomestudio"
        },
        "telefone": {
          "pontos": 15,
          "maximo": 15,
          "presente": true
        },
        "endereco": {
          "pontos": 5,
          "maximo": 5,
          "presente": true
        },
        "nota": {
          "pontos": 4.8,
          "maximo": 5,
          "valor": 4.8
        },
        "quantidade_avaliacoes": {
          "pontos": 12.3,
          "maximo": 15,
          "valor": 56,
          "referencia_percentil_95": 137.45
        }
      },
      "score_justificativa": [
        "Possui rede social ou página intermediária, mas não site próprio.",
        "Possui telefone para contato.",
        "Possui endereço informado.",
        "Nota bruta considerada: 4.8 de 5.",
        "Quantidade de avaliações considerada: 56; pontuação calculada em escala logarítmica."
      ]
    }
  },
  "commercialScore": 97.1,
  "pipelineStatus": "approved",
  "updatedAt": "2026-08-13T04:49:30Z"
}
