{
  "schemaVersion": 1,
  "studioId": "dom-faro-records-estudio-de-gravacao-uberlandia-e18ef7",
  "sourceId": "e18ef7e8d8c3baf0345a79e2cd7c6579fc948e90583fbf806810351f1a01a3bf",
  "name": "Dom Faro Records - Estúdio de Gravação",
  "type": "Recording studio",
  "slug": "dom-faro-records-estudio-de-gravacao",
  "location": {
    "city": "Uberlândia",
    "state": "Minas Gerais",
    "address": "Av. Solidariedade - Morumbi, Uberlândia - MG, 38407-226, Brazil",
    "latitude": -18.9148364,
    "longitude": -48.1985763
  },
  "contacts": {
    "phone": "+55 34 99260-9804",
    "website": "https://www.instagram.com/domfarorec/",
    "instagram": "https://www.instagram.com/domfarorec/"
  },
  "source": {
    "importedAt": "2026-08-13T04:49:30Z",
    "sourceFile": "estudios_musica.json",
    "sourceHash": "2ac798d2a49138dfcb73d8e08fca9639e6a21b95a1ed760544ea24f8fe7fcd29",
    "originalRecord": {
      "title": "Dom Faro Records - Estúdio de Gravação",
      "type": "Recording studio",
      "cidade": "Uberlândia",
      "estado": "Minas Gerais",
      "ratingCount": 43,
      "rating": 5,
      "address": "Av. Solidariedade - Morumbi, Uberlândia - MG, 38407-226, Brazil",
      "phoneNumber": "+55 34 99260-9804",
      "website": "https://www.instagram.com/domfarorec/",
      "latitude": -18.9148364,
      "longitude": -48.1985763,
      "score_comercial": 96.51,
      "score_componentes": {
        "website": {
          "pontos": 60,
          "maximo": 60,
          "categoria": "rede_social_ou_intermediario",
          "valor": "https://www.instagram.com/domfarorec/"
        },
        "telefone": {
          "pontos": 15,
          "maximo": 15,
          "presente": true
        },
        "endereco": {
          "pontos": 5,
          "maximo": 5,
          "presente": true
        },
        "nota": {
          "pontos": 5,
          "maximo": 5,
          "valor": 5
        },
        "quantidade_avaliacoes": {
          "pontos": 11.51,
          "maximo": 15,
          "valor": 43,
          "referencia_percentil_95": 137.45
        }
      },
      "score_justificativa": [
        "Possui rede social ou página intermediária, mas não site próprio.",
        "Possui telefone para contato.",
        "Possui endereço informado.",
        "Nota bruta considerada: 5.0 de 5.",
        "Quantidade de avaliações considerada: 43; pontuação calculada em escala logarítmica."
      ]
    }
  },
  "commercialScore": 96.51,
  "pipelineStatus": "approved",
  "updatedAt": "2026-08-13T04:49:30Z"
}
