{
  "schemaVersion": 1,
  "studioId": "groove-estudio-mogi-das-cru-29fa72",
  "sourceId": "29fa722fee39e512d44259442796513dbefe16c4f69d7511265e2b760717d5b6",
  "name": "Groove Estúdio",
  "type": "Recording studio",
  "slug": "groove-estudio",
  "location": {
    "city": "Mogi das Cruzes",
    "state": "São Paulo",
    "address": "Av. Alexandrina de Paula, 368 - Vila Nova Cintra, Mogi das Cruzes - SP, 08744-090, Brazil",
    "latitude": -23.541853999999997,
    "longitude": -46.229997499999996
  },
  "contacts": {
    "phone": "+55 11 93417-4728",
    "website": "https://instagram.com/_grooveestudio",
    "instagram": "https://instagram.com/_grooveestudio"
  },
  "source": {
    "importedAt": "2026-08-13T04:49:30Z",
    "sourceFile": "estudios_musica.json",
    "sourceHash": "f22598ce4cec20fca3958720ca866201345bba6096da0ef2dea177c1e056c4ad",
    "originalRecord": {
      "title": "Groove Estúdio",
      "type": "Recording studio",
      "cidade": "Mogi das Cruzes",
      "estado": "São Paulo",
      "ratingCount": 25,
      "rating": 4.6,
      "address": "Av. Alexandrina de Paula, 368 - Vila Nova Cintra, Mogi das Cruzes - SP, 08744-090, Brazil",
      "phoneNumber": "+55 11 93417-4728",
      "website": "https://instagram.com/_grooveestudio",
      "latitude": -23.541853999999997,
      "longitude": -46.229997499999996,
      "score_comercial": 94.51,
      "score_componentes": {
        "website": {
          "pontos": 60,
          "maximo": 60,
          "categoria": "rede_social_ou_intermediario",
          "valor": "https://instagram.com/_grooveestudio"
        },
        "telefone": {
          "pontos": 15,
          "maximo": 15,
          "presente": true
        },
        "endereco": {
          "pontos": 5,
          "maximo": 5,
          "presente": true
        },
        "nota": {
          "pontos": 4.6,
          "maximo": 5,
          "valor": 4.6
        },
        "quantidade_avaliacoes": {
          "pontos": 9.91,
          "maximo": 15,
          "valor": 25,
          "referencia_percentil_95": 137.45
        }
      },
      "score_justificativa": [
        "Possui rede social ou página intermediária, mas não site próprio.",
        "Possui telefone para contato.",
        "Possui endereço informado.",
        "Nota bruta considerada: 4.6 de 5.",
        "Quantidade de avaliações considerada: 25; pontuação calculada em escala logarítmica."
      ]
    }
  },
  "commercialScore": 94.51,
  "pipelineStatus": "approved",
  "updatedAt": "2026-08-13T04:49:30Z"
}
